"d_state_of_death","d_year_death","d_last_name","d_first_name","d_notes","d_fact_check","i_red_flags","i_notes","me_autopsy_red_flags","x_standout","d_dob","d_dod","d_age","d_gender","d_race","d_ethnicity","d_online_links","d_background_info","d_officer_intel","i_date","i_city","i_state","i_location","i_le_agencies","i_how_init","i_why_init","i_deescalation","i_deceased_actions_before_force","i_uof_type","i_police_actions_after_handcuffed","i_medical_aid","i_police_inconsistencies","i_factcheck","a_oversight_bodies","a_lawsuit_filed","a_lawsuit_outcome","a_payment","a_notes","a_factcheck","me_manner_death","me_cause_death","me_death_flags","me_manner_agency_name","x_entry_timestamp","x_theme","x_notes","x_data_progress","y_data_progress","y_factcheck","x_pull_date"
"Arkansas","2015","FALLS","ERIC","Suspected shoplifter at Walmart. Police say he ate drugs during questioning. Was shocked with taser multiple times during struggle. Police suspected he was having reaction to drugs he ate. Taken to hospital. He was alive when he arrived but died soon after. The medical examiner found one bag each of methamphetamine and marijuana in his stomach.","https://www.documentcloud.org/documents/21713577-arkansas-eric-falls-asp-report-2015-1742_redacted","","","","","1998-10-05","2015-11-29","27","Male","White","Unknown","https://www.legacy.com/us/obituaries/houstonchronicle/name/eric-falls-obituary?id=18254661","[""History of substance abuse""]","[""Unknown""]","2015-11-29","Dardanelle","Arkansas","Private business","[""Dardanelle Police Department ""]","911 call - other","","[""Calm conversation to establish rapport"",""Verbal persuasion""]","[""Failing to respond to officer commands"",""Resist handcuffs""]","[""Taser or Conducted Energy Weapon (CEW) - darts"",""Taser or Conducted Energy Weapon (CEW) - drive-stun""]","","SKIP - no longer collecting","","https://www.documentcloud.org/documents/21713577-arkansas-eric-falls-asp-report-2015-1742_redacted","[""State police"",""District or state attorney""]","[""Unknown""]","","0","","","","methamphetamine intoxication","[""Drug use""]","Arkansas State Crime Lab","2022-07-14 15:23:19","[""Taser""]","","Ongoing","Ongoing","Page 134 https://www.documentcloud.org/documents/21713577-arkansas-eric-falls-asp-report-2015-1742_redacted","2022-11-01T05:18:49.392Z"
"California","2016","LIGHTHIPE","MARK","Long criminal history. According to DA, friends said he had a long-time drug problem and had just inherited some money and had been blowing through it on meth. He told officers he was high the night of his arrest and a syringe was found in his pocket.","https://www.documentcloud.org/documents/22037274-california-_-mark-lighthipe-orange-county-da-report https://www.documentcloud.org/documents/22037172-california-_-mark-lighthipe-orange-county-coroner-report","","Lighthipe appears to have gone unresponsive in the ambulance on the way to the hospital. He had been given Versed on the scene in a parking lot near a Walmart. People had called police because he was acting strange, hitting cars and walked into a gym at which he was not a member and appeared to the callers to be high on drugs. Documents note that it was hard to give him a catheter in the hospital because he had a string tied around his penis and there was blood gathering.","","","","2016-11-07","43","Male","White","","No","[""History of violence"",""History of substance abuse""]","[""Unknown""]","2016-11-04","Garden Grove","California","Parking lot","[""Garden Grove Police Department""]","911 call - other","Public intoxication","[""Calm conversation to establish rapport"",""Backup or extra resources requested before physicality or force"",""Offer help - other""]","[""Failing to respond to officer commands""]","[""Hobble restraint"",""Handcuffs"",""Prone position - with officer bodyweight or pressure"",""Chemical restraint (sedative)""]","","SKIP - no longer collecting","","https://www.documentcloud.org/documents/22037274-california-_-mark-lighthipe-orange-county-da-report https://www.documentcloud.org/documents/22037172-california-_-mark-lighthipe-orange-county-coroner-report","[""District or state attorney""]","[""Unknown""]","","0","","https://www.documentcloud.org/documents/22037274-california-_-mark-lighthipe-orange-county-da-report https://www.documentcloud.org/documents/22037172-california-_-mark-lighthipe-orange-county-coroner-report","Accidental","Acute amphetamine and methamphetamine intoxication","[""Drug use""]","Orange County Sheriff-Coroner Department","2022-06-06 16:07:12","","","Ongoing","Complete","https://www.documentcloud.org/documents/22037172-california-_-mark-lighthipe-orange-county-coroner-report","2022-11-01T05:18:49.392Z"
"Louisiana","2017","FRANK","ARMANDO","Frank was known around his small town as ""the man on the tractor"" since he frequently drove his red tractor around Marksville. He was a lifelong resident of the community, according to a federal lawsuit.     Though it's unclear what deputies knew about Frank's background, at least one of them knew that he was a military veteran. The deputy says he tried to establish a rapport with Frank by telling him that he is also a military veteran, the deputy said in interviews with investigators.     Medical records from the U.S. Veterans Administration indicate that he had been diagnosed with schizophrenia.","https://www.documentcloud.org/documents/22072109-frank_warrent_that_includes-dob https://www.documentcloud.org/documents/22072108-frank_va_records_incl_mental_health https://www.documentcloud.org/documents/22072111-frank_amended_complaint","Medical examiner said in the autopsy that officers failed to provide aid to Frank after he was dragged off the tractor; In a deposition, the medical examiner said he thought they should have rendered aid.      A lawsuit also notes accuses the officers of violating Louisiana law by not telling Frank about the warrant that led to the encounter, even though he asked several times why they wanted him to climb down from his tractor.","A carotid sleeper hold that evolved into a bar hold is cited in the autopsy.     ""There are injuries that are consistent with evidence of a manual strangulation,"" the pathologist wrote in the autopsy.     Officers also pressed Frank's body against his tractor. He was cuffed face-down with his hands behind his back and ""multiple personnel partially on back and neck."" He was then loaded into an SUV face-down with his hands cuffed behind his back.    All told, Frank sustained 6 minutes and 42 seconds of respiratory compromise, the autopsy states.    Officers also failed to render aid, the pathologist wrote after reviewing body cam video. Someone on the video is heard asking, ""is he breathing, get him up, but there is no response and no action,"" the autopsy states.    In a lengthy deposition, the pathologist says he thinks that officers should have helped Frank after the physical encounter.    ""I think they should have given him basic first aid, that's what I think,"" he said.    ""I'm pro law enforcement,"" he added. ""I just want us to do better. I want us to learn.""","","The case might be a good storytelling opportunity. Armando Frank, known around his small Louisiana town as ""the man on the tractor,"" was sitting atop his red tractor in a Walmart parking lot when three officers tried to remove him from it and take him into custody. They tased Frank multiple times, used a carotid sleeper hold that evolved into a bar hold, pressed Frank's body against his tractor, and eventually pressed on his body as he lay in a prone position and handcuffed with his hands behind his back. It's also an example of law officers failing to provide aid after the initial encounter, per autopsy findings and the deposition of the medical examiner.","1973-09-05","2017-10-20","44","Male","Black","Unknown","https://www.legacy.com/obituaries/name/armando-frank-obituary?pid=187075452","[""History of mental illness"",""Military veteran""]","[""Other""]","2017-10-20","Marksville","Louisiana","Parking lot","[""Avoyelles Parish Sheriff's Office"",""Marksville Police Department""]","Other","Arrest warrant pending","[""Calm conversation to establish rapport"",""Verbal persuasion"",""Delay taking action to give deceased time to calm down or comply"",""Warnings of imminent force or restraint""]","[""Failing to respond to officer commands""]","[""Taser or Conducted Energy Weapon (CEW) - darts"",""Taser or Conducted Energy Weapon (CEW) - drive-stun"",""Struck with baton or other object"",""Chokehold or carotid restraint"",""Handcuffs"",""Prone position - with officer bodyweight or pressure""]","[""Left deceased face-down"",""Bodyweight pressure""]","SKIP - no longer collecting","In their initial police statements, the officers either fail to mention the neck holds, or downplay them.","https://www.documentcloud.org/documents/22072097-frank_detailed_incident_report https://www.documentcloud.org/documents/22072105-frank_supplementary_report https://www.documentcloud.org/documents/22072100-frank_investigative_report https://www.documentcloud.org/documents/22072111-frank_amended_complaint","[""Local sheriff""]","[""Federal""]","Pending","0","Federal lawsuit is pending in U.S. District Court in Louisiana (Western District)","https://www.documentcloud.org/documents/22072111-frank_amended_complaint","Homicide","Asphyxia due to respiratory compromise due to law enforcement arrest with contribution of hypertensive atherosclerotic cardiovascular disease, obesity (BMI=37) and electronic control device shocks.","[""Prone position"",""Positional asphyxia"",""Law enforcement""]","Louisiana Forensic Center LLC","2022-10-06 15:32:00","[""Mental illness"",""Taser""]","","Ongoing","Ongoing","https://www.documentcloud.org/documents/22072114-frank_autopsy#document/p4/a2119798 https://www.documentcloud.org/documents/22072096-frank_deposition_of_medical_examiner","2022-11-01T05:18:49.392Z"
"Missouri","2017","PRINCE","BRIAN","He served a long federal prison term for bank robbery and got out of federal supervision in March 2017, BOP inmate search shows","https://www.documentcloud.org/documents/21199956-brianprinceautopsyreport#document/p1/a2152916","The 240-pound officer was running full speed when he grabbed Prince (who weighed only 89 pounds, according to a prosecutor, and threw him to the ground on the tile floor near the Walmart entrance. His head struck the floor and a pool of blood appeared immediately. Officer then straddled him in the prone position with a knee in his back even as he was passed out, the video shows.","","The autopsy twice says that Prince suffered the head injury when he was tackled by ""security personnel"" at a ""general store,"" not mentioning that it was a Kansas City police officer at a Walmart.","How a shoplifting arrest at Walmart turned deadly within seconds and a police department covered it up","1972-07-30","2017-10-01","45","Male","White","Unknown","https://www.aldenharrington.com/memorials/brian-prince/3189166/obituary.php   https://www.kansascity.com/article253571699.html","[""History of violence"",""History of substance abuse""]","","2017-09-02","Kansas City","Missouri","Private business","[""Kansas City Police Department""]","911 call - other","Property crime","[""None of the above - officer(s) rapidly resorted to force""]","[""Flee by foot"",""Breaking officer grip""]","[""Tackled"",""Prone position - with officer bodyweight or pressure""]","[""Bodyweight pressure"",""Left deceased face-down""]","Asked for medical assistance (if not at scene)","The Kansas City Police Department did not publicize the incident, and the prosecutor's office didn't issue its review until more than two years later, after the family hired a lawyer and filed a lawsuit. Prince's parents said they weren't told what happened to their son for days.","https://www.documentcloud.org/documents/22925224-brianprinceprosecutorletter#document/p1/a2152933 See also the video in shared folder. And: https://account.kansascity.com/paywall/stop?resume=253571699","[""District or state attorney""]","[""State""]","Pending","0","","https://www.documentcloud.org/documents/22925224-brianprinceprosecutorletter#document/p1/a2152933 https://account.kansascity.com/paywall/stop?resume=253571699","Homicide","blunt force head trauma","","Jackson County Medical Examiner","2022-09-26 15:26:09","[""Rapid escalation"",""Police cover-up""]","","Complete","Complete","https://www.documentcloud.org/documents/21199956-brianprinceautopsyreport#document/p1/a2079537","2022-11-01T05:18:49.392Z"
"Missouri","2019","MCCURDY","WALLY","Obituary says he spent six months in the National Guard.","https://www.documentcloud.org/documents/22670351-wallymccurdyincidentreport#document/p57/a2151606","The severity of the crime _ shoplifting at Walmart _ would weigh against the deployment of a Taser given that he was unarmed and not threatening anyone.","McCurdy and a female acquaintance allegedly shoplifted $318 worth of merchandise. 3 DVDs, 1 boxed virtual reality headset and 4 cans of beer (still cold, according to police report) were found in McCurdy's backpack. The other officer said he put his hand on McCurdy's chest but ""did not remember"" if he put his knees on him. Officers only got one handcuff on McCurdy before he started having trouble breathing and never fully handcuffed him.","A Springfield Police Detective told the medical examiner's office that McCurdy ""looked to have placed something in his mouth during the foot pursuit,"" suggesting a drug overdose. However, that turned out not to be the case as no ""foreign objects"" were found in his mouth or airway. His death certificate is somewhat misleading by saying he ""collapsed as he was being taken into custody, while attempting to flee from police on foot."" He was tased and taken down, restrained and then he stopped breathing.","How an aggressive police response to a shoplifting incident at WalMart quickly turned into a fatal encounter. We have previously unreported police reports with some new details.","1986-07-23","2019-04-01","32","Male","White","Not Hispanic","https://www.gormanscharpf.com/obituary/wally-mccurdy","[""History of substance abuse"",""History of mental illness"",""Military veteran""]","","2019-04-01","Springfield","Missouri","Private business","[""Springfield Police Department""]","Other","Property crime","[""Warnings of imminent force or restraint""]","[""Flee by foot"",""Failing to respond to officer commands""]","[""Taser or Conducted Energy Weapon (CEW) - darts"",""Take-down"",""Prone position - no pressure applied or unclear"",""Other""]","[""No further force/restraint""]","Asked for medical assistance (if not at scene)","The city's initial press release said that McCurdy ""continued to run"" after the deployment of the Taser, when in fact he stopped and was taken down. The police account is inconsistent on whether McCurdy was in the prone position and what force was used. One officer wrote that he and another officer forced McCurdy to the ground, held him down on his back and then, ""Wally began to complain about us holding him down, but stopped physically straining against us and we rolled him onto his stomach in preparation for handcuffing. I got one handcuff on, but noticed Wally was no longer talking and appeared short of breath."" The officer later told an investigator McCurdy was on his side while being handcuffed. The other officer never mentioned McCurdy being on his stomach but did note they moved him into the recovery position. An officer told an investigator he put his knee into McCurdy's chest for 10 to 15 seconds before rolling him to his side -- a fact he didn't mention in his report.","https://www.documentcloud.org/documents/22670351-wallymccurdyincidentreport#document/p1/a2152015 https://www.documentcloud.org/documents/22672159-wally-mccurdy-springfield-pd-press-releases#document/p1/a2152046","[""District or state attorney""]","[""No""]","","0","His grandmother, Phyllis Sanford, had questions about the incident and had raised him since age 3","https://www.documentcloud.org/documents/22670352-wallymccurdyprosecutorletter#document/p1/a2152047","Accidental","cardiac arrythmia due to the combination of of exertion, left ventricular hypertrophy, and methamphetamine intoxication","[""Physical exertion"",""Law enforcement"",""Drug use""]","Greene County Medical Examiner's Office","2022-09-22 15:26:26","[""Taser"",""Rapid escalation""]","","Complete","Complete","https://www.documentcloud.org/documents/22670351-wallymccurdyincidentreport#document/p46/a2151609","2022-11-01T05:18:49.392Z"
